{"blockers":[],"candidate_bundle":{"sha256":"6a2a868396e8b46c98940d388b57185f9416e17028ec4463ea07261e4c8bf5a2","skill_candidate_bundle_id":"skill-candidate-db6cd3af88edb845"},"checks":[{"check":"bundle_integrity","result":"pass"},{"check":"payload_integrity","result":"pass"},{"check":"restricted_content","result":"pass"},{"check":"platform_metadata","result":"pass"},{"check":"trigger_contract","result":"pass"},{"check":"registry_collision","result":"pass"},{"check":"router_examples","result":"pass"},{"check":"payload_diff","result":"pass"}],"claims":{"activation_authorized":false,"candidate_bundle_verified":true,"fresh_session_validated":false,"installation_authorized":false,"payload_bytes_verified":true,"platform_metadata_validated":true,"private_evaluation_completed":false,"publication_authorized":false,"restricted_content_checked":true,"router_examples_statically_checked":true,"runtime_loaded":false,"semantic_review_completed":false,"static_validation_completed":true,"static_validation_passed":true,"trigger_collision_checked":true,"trigger_contract_statically_checked":true},"limitations":["Static validation does not establish semantic correctness or reviewer independence.","Router examples are checked against declared strings, not executed by an Agent.","Registry collision checks use an exact normalized snapshot and are not semantic search.","No Skill is materialized, loaded, installed, activated, published, or promoted."],"outcome":"static_pass","payload_diff":{"added":["SKILL.md","agents/openai.yaml","references/math.md"],"baseline_snapshot_sha256":"4f53cda18c2baa0c0354bb5f9a3ecbe5ed12ab4d8e11ba873c2f11161202b945","modified":[],"removed":[]},"platform_metadata":{"present":true,"required_path":"agents/openai.yaml","sha256":"8b76073bc322e97146528de5c8a5d71cee7a4581c32df9f591d1d6a6e868c6cf","size_bytes":233},"registry_snapshot":{"sha256":"16b629e436631428b324b4ec105a40ed45274d4d6ec28d93229903d4d83cb854","skills_count":1},"router_examples":{"reject_candidate":1,"select_candidate":1,"sha256":"dfea033e058b0ddbe42e2af2bcff2997c5a9e158bf311c1699c789d863bbde28","total":2},"schema":"skill-static-validation-receipt/v1","skill_static_validation_receipt_id":"skill-static-validation-89b670d4e65b3d44","validated_at":"2026-08-25T00:00:00Z","validator":{"policy_id":"p7b3-static-policy-v1","policy_sha256":"6601164e9711193e0977d3e855e10e329b538fe4ca6497dd16de5e011b6d6745","principal":"static-validator-math","tool":"in-process-skill-static-validator","version":"1.0.0"}}
